IT3223 ADBMS
2021/ICT/30

Date : 2026.02.19
==================================================

1)
CREATE USER 2021ICT30@localhost;


2)
MariaDB [(none)]> SHOW databases;
+--------------------+
| Database           |
+--------------------+
| csc1223            |
| information_schema |
| mysql              |
| performance_schema |
| phpmyadmin         |
| project_supply     |
| supply_pro         |
| test               |
+--------------------+
8 rows in set (0.001 sec)


2)
MariaDB [(none)]> USE mysql;
Database changed


3)
MariaDB [mysql]> SHOW tables;
+---------------------------+
| Tables_in_mysql           |
+---------------------------+
| column_stats              |
| columns_priv              |
| db                        |
| event                     |
| func                      |
| general_log               |
| global_priv               |
| gtid_slave_pos            |
| help_category             |
| help_keyword              |
| help_relation             |
| help_topic                |
| index_stats               |
| innodb_index_stats        |
| innodb_table_stats        |
| plugin                    |
| proc                      |
| procs_priv                |
| proxies_priv              |
| roles_mapping             |
| servers                   |
| slow_log                  |
| table_stats               |
| tables_priv               |
| time_zone                 |
| time_zone_leap_second     |
| time_zone_name            |
| time_zone_transition      |
| time_zone_transition_type |
| transaction_registry      |
| user                      |
+---------------------------+
31 rows in set (0.001 sec)


4)
MariaDB [mysql]> SELECT user, host FROM user;
+-----------+-----------+
| User      | Host      |
+-----------+-----------+
| root      | 127.0.0.1 |
| root      | ::1       |
| 2021ICT30 | localhost |
| pma       | localhost |
| root      | localhost |
+-----------+-----------+


5)
MariaDB [mysql]> SELECT user, host, password FROM user;
+-----------+-----------+----------+
| User      | Host      | Password |
+-----------+-----------+----------+
| root      | localhost |          |
| 2021ICT30 | localhost |          |
| root      | 127.0.0.1 |          |
| root      | ::1       |          |
| pma       | localhost |          |
+-----------+-----------+----------+


6)create user with password

MariaDB [mysql]> CREATE USER 2021ict30@localhost IDENTIFIED BY 'ict@123';
Query OK, 0 rows affected (0.002 sec)


7)
MariaDB [mysql]> SELECT user,host,password FROM user;
+-----------+-----------+-------------------------------------------+
| User      | Host      | Password                                  |
+-----------+-----------+-------------------------------------------+
| root      | localhost |                                           |
| 2021ICT30 | localhost |                                           |
| root      | 127.0.0.1 |                                           |
| root      | ::1       |                                           |
| pma       | localhost |                                           |
| 2021ict30 | localhost | *193296A24DF635BD8F1D883BEAEC1D589F05463D |
+-----------+-----------+-------------------------------------------+
6 rows in set (0.001 sec)


8)
DROP USER 2021ICT30@localhost;


9) change username , password
UPDATE user 
set user='2021ict30_new' 
WHERE user='2021ict30';


10)
UPDATE user 
set host='localhostNew' 
WHERE user='2021ict30_new';


MariaDB [mysql]> SELECT user,host,password FROM user;
+---------------+--------------+-------------------------------------------+
| User          | Host         | Password                                  |
+---------------+--------------+-------------------------------------------+
| root          | localhost    |                                           |
| root          | 127.0.0.1    |                                           |
| root          | ::1          |                                           |
| pma           | localhost    |                                           |
| 2021ict30_new | localhostNew | *193296A24DF635BD8F1D883BEAEC1D589F05463D |
+---------------+--------------+-------------------------------------------+
5 rows in set (0.001 sec)


11)
CREATE USER 2021ICT30@localhost;

SET password 
FOR '2021ICT30'@localhost=password('ict@123new');


MariaDB [mysql]> SELECT user,host,password FROM user;
+---------------+--------------+-------------------------------------------+
| User          | Host         | Password                                  |
+---------------+--------------+-------------------------------------------+
| root          | localhost    |                                           |
| 2021ICT30     | localhost    | *6885119D8FADF81503D27BCA8225390FB2449037 |
| root          | 127.0.0.1    |                                           |
| root          | ::1          |                                           |
| pma           | localhost    |                                           |
| 2021ict30_new | localhostNew | *193296A24DF635BD8F1D883BEAEC1D589F05463D |
+---------------+--------------+-------------------------------------------+

//delete 2021ict30_new 
DELETE FROM mysql.user WHERE User='2021ict30_new' AND Host='localhostNew';
FLUSH PRIVILEGES;

==================================================

1)create two users Student_1 and Student_2 with the password '123456' 
  at the localhost 
  
2) list down the created users

3) change the username of Student_1 with your Registration NUMBER

4) list down the username and password

5) change the password of Student_2 with a new password 

6) list down username and password again.

7) change the host of student_2 to 'vau.ac.lk'

8) list down the username and host name 

==================================================

SHOW databases;
+--------------------+
| Database           |
+--------------------+
| csc1223            |
| information_schema |
| mysql              |
| performance_schema |
| phpmyadmin         |
| project_supply     |
| supply_pro         |
| test               |
+--------------------+

MariaDB [(none)]> use test;
Database changed

MariaDB [test]> SHOW tables;
Empty set (0.001 sec)

CREATE TABLE sample_1(col_1 VARCHAR(5));

GRANT SELECT ON test.sample_1 TO 'student01'@'localhost';

SHOW GRANTS FOR 'student01'@'localhost';
+--------------------------------------------------------------+
| Grants for student01@localhost                               |
+--------------------------------------------------------------+
| GRANT USAGE ON *.* TO `student01`@`localhost`                |
| GRANT SELECT ON `test`.`sample_1` TO `student01`@`localhost` |
+--------------------------------------------------------------+

--------------------------
open new shell

User@CL2-90 c:\xampp
# mysql -u student01
Welcome to the MariaDB monitor.  Commands end with ; or \g.
Your MariaDB connection id is 14
Server version: 10.4.32-MariaDB mariadb.org binary distribution

Copyright (c) 2000, 2018, Oracle, MariaDB Corporation Ab and others.

Type 'help;' or '\h' for help. Type '\c' to clear the current input statement.

MariaDB [(none)]> show databases;
+--------------------+
| Database           |
+--------------------+
| information_schema |
| test               |
+--------------------+
2 rows in set (0.001 sec)

MariaDB [(none)]> use test;
Database changed
MariaDB [test]> show tables;
+----------------+
| Tables_in_test |
+----------------+
| sample_1       |
+----------------+
1 row in set (0.001 sec)

MariaDB [test]> SELECT * FROM sample_1;
Empty set (0.003 sec)

INSERT INTO sample_1